### DISCUSSION TITLE
Error 503 due to allowed_clients rejecting connections from Apache (with workaround)

### DISCUSSION THREAD

**Discussion by lyphyser** [nextcloud/all-in-one#3654] [Questions] [answered]
Currently on my 7.5.0 Nextcloud AIO is rejecting all connections with 503 errors and logging this into Nextcloud logs:
```
ERROR: Connection disallowed: IP address '172.18.0.1' has been dropped.
```

The error can be worked around with these commands:
```
sudo docker exec --user www-data -i nextcloud-aio-nextcloud sed -i -re 's/(allowed_clients = .*)/\1,172.18.0.1/' /usr/local/etc/php-fpm.d/www.conf
sudo docker exec --user root -i nextcloud-aio-nextcloud killall -USR2 php-fpm
```

The reason seems to be that connections from the Apache container to the Nextcloud one are appearing to come from a 172.18.0.1 IP address (the one of the host) rather than 172.18.0.8 (the one of the Apache container that is automatically added to allowed_clients by start.sh)

Using tcpdump on the docker host, it appears that connections to port 9000 on the Nextcloud instance are indeed coming from 172.18.0.8:
```
    172.18.0.8.53560 > 172.18.0.6.9000: Flags [S], cksum 0x5861 (incorrect -> 0x748b), seq 1252640164, win 64240, options [mss 1460,sackOK,TS val 2916535755 ecr 0,nop,wscale 7], length 0
```

They do however come with a HTTP_X_FORWARDED_FOR header that may be the cause of the issue:
```
    172.18.0.8.53568 > 172.18.0.6.9000: Flags [P.], cksum 0x5f6f (incorrect -> 0xc16d), seq 17:1831, ack 1, win 502, options [nop,nop,TS val 2916536877 ecr 4007387224], length 1814
[...]
        0x03f0:  0a48 5454 505f 585f 464f 5257 4152 4445  .HTTP_X_FORWARDE
        0x0400:  445f 464f 5231 3732 2e31 382e 302e 3115  D_FOR172.18.0.1.
```

So perhaps Nextcloud needs to be taught to ignore HTTP_X_FORWARDED_FOR when determining the source for allowed_clients, or Apache taught to not send that header, or alternatively the host can be added to allowed_clients or allowed_clients removed entirely.

Alternatively it's also maybe possible that something in Docker or host network/firewall configuration is making the TCP connection source IP appear to be 172.18.0.1 from inside the container.

**Comment by szaimen** [comment]
Hi, can you post your apache config here and also the output of `sudo docker inspect nextcloud-aio-apache` ?

**Reply by lyphyser** [reply]
I managed to run tcpdump in the container and it seems that inside the container, the source address of the apache to php-fpm connections is actually 172.18.0.1 (the one of the host).

```
sudo nsenter -t `pidof -s php-fpm` -n tcpdump -i eth0
15:39:15.257272 IP 172.18.0.1.36228 > 172.18.0.6.9000: Flags [S], seq 1016356430, win 64240, options [mss 1460,sackOK,TS val 3283572039 ecr 0,nop,wscale 7], length 0
```

So it looks like that either docker or the host firewall are somehow causing connections in the NextCloud docker network to be masqueraded so that the source address appears to be the gateway instead of the apache container.

**Reply by lyphyser** [reply]
So it looks like the problem is that my iptables nat POSTROUTING contains this rule:
```
 181K   11M MASQUERADE  all  --  any    any     anywhere             anywhere            
```
Which I think is added by my OS setup and not docker or NextCloud.

Hence probably not a bug in NextCloud AIO, unless there is a desire to workaround such questionable host configurations.

**Reply by szaimen** [reply, marked as answer]
> So it looks like that either docker or the host firewall are somehow causing connections in the NextCloud docker network to be masqueraded so that the source address appears to be the gateway instead of the apache container.
>
> Hence probably not a bug in NextCloud AIO

Indeed

**Reply by lyphyser** [reply]
Although it used to work before and I think it's very likely I always had that masquerade rule, so it might be a regression perhaps due to the allowed_ips enforcement being added to recent nextcloud AIO versions.

**Reply by lyphyser** [reply]
Yes, it seems the allowed_clients restrictions was added 2 months ago in 7.4, and it has broken any setup like mine.

**Reply by lyphyser** [reply]
Not sure whether to consider it a bug.

On one hand, such a networking configuration is not great for Docker inter-container communication, so it could be considered broken and thus not reasonable to support by NextCloud AIO, and I think enforcing allowed_clients by default might make sense for security purposes.

On the other hand, this is the way Qubes OS currently sets the network and Nextcloud AIO used to work on it before 7.3, so it could be considered a regression to fix.

**Reply by szaimen** [reply]
Hi, see https://github.com/nextcloud/all-in-one/discussions/3654#discussioncomment-7446582

**Comment by lyphyser** [comment]
sudo docker exec nextcloud-aio-apache /usr/local/apache2/bin/httpd -v
```
Server version: Apache/2.4.58 (Unix)
Server built:   Oct 19 2023 19:22:55
```

sudo docker exec nextcloud-aio-apache cat /usr/local/apache2/conf/httpd.conf
```
#
# This is the main Apache HTTP server configuration file.  It contains the
# configuration directives that give the server its instructions.
# See <URL:http://httpd.apache.org/docs/2.4/> for detailed information.
# In particular, see 
# <URL:http://httpd.apache.org/docs/2.4/mod/directives.html>
# for a discussion of each configuration directive.
#
# Do NOT simply read the instructions in here without understanding
# what they do.  They're here only as hints or reminders.  If you are unsure
# consult the online docs. You have been warned.  
#
# Configuration and logfile names: If the filenames you specify for many
# of the server's control files begin with "/" (or "drive:/" for Win32), the
# server will use that explicit path.  If the filenames do *not* begin
# with "/", the value of ServerRoot is prepended -- so "logs/access_log"
# with ServerRoot set to "/usr/local/apache2" will be interpreted by the
# server as "/usr/local/apache2/logs/access_log", whereas "/logs/access_log" 
# will be interpreted as '/logs/access_log'.

#
# ServerRoot: The top of the directory tree under which the server's
# configuration, error, and log files are kept.
#
# Do not add a slash at the end of the directory path.  If you point
# ServerRoot at a non-local disk, be sure to specify a local disk on the
# Mutex directive, if file-based mutexes are used.  If you wish to share the
# same ServerRoot for multiple httpd daemons, you will need to change at
# least PidFile.
#
ServerRoot "/usr/local/apache2"

#
# Mutex: Allows you to set the mutex mechanism and mutex file directory
# for individual mutexes, or change the global defaults
#
# Uncomment and change the directory if mutexes are file-based and the default
# mutex file directory is not on a local disk or is not appropriate for some
# other reason.
#
# Mutex default:logs

#
# Listen: Allows you to bind Apache to specific IP addresses and/or
# ports, instead of the default. See also the <VirtualHost>
# directive.
#
# Change this to Listen on specific IP addresses as shown below to 
# prevent Apache from glomming onto all bound IP addresses.
#
#Listen 12.34.56.78:80

#
# Dynamic Shared Object (DSO) Support
#
# To be able to use the functionality of a module which was built as a DSO you
# have to place corresponding `LoadModule' lines at this location so the
# directives contained in it are actually available _before_ they are used.
# Statically compiled modules (those listed by `httpd -l') do not need
# to be loaded here.
#
# Example:
# LoadModule foo_module modules/mod_foo.so
#
LoadModule mpm_event_module modules/mod_mpm_event.so
##LoadModule mpm_prefork_module modules/mod_mpm_prefork.so
##LoadModule mpm_worker_module modules/mod_mpm_worker.so
LoadModule authn_file_module modules/mod_authn_file.so
#LoadModule authn_dbm_module modules/mod_authn_dbm.so
#LoadModule authn_anon_module modules/mod_authn_anon.so
#LoadModule authn_dbd_module modules/mod_authn_dbd.so
#LoadModule authn_socache_module modules/mod_authn_socache.so
LoadModule authn_core_module modules/mod_authn_core.so
LoadModule authz_host_module modules/mod_authz_host.so
LoadModule authz_groupfile_module modules/mod_authz_groupfile.so
LoadModule authz_user_module modules/mod_authz_user.so
#LoadModule authz_dbm_module modules/mod_authz_dbm.so
#LoadModule authz_owner_module modules/mod_authz_owner.so
#LoadModule authz_dbd_module modules/mod_authz_dbd.so
LoadModule authz_core_module modules/mod_authz_core.so
#LoadModule authnz_ldap_module modules/mod_authnz_ldap.so
#LoadModule authnz_fcgi_module modules/mod_authnz_fcgi.so
LoadModule access_compat_module modules/mod_access_compat.so
LoadModule auth_basic_module modules/mod_auth_basic.so
#LoadModule auth_form_module modules/mod_auth_form.so
#LoadModule auth_digest_module modules/mod_auth_digest.so
#LoadModule allowmethods_module modules/mod_allowmethods.so
#LoadModule isapi_module modules/mod_isapi.so
#LoadModule file_cache_module modules/mod_file_cache.so
#LoadModule cache_module modules/mod_cache.so
#LoadModule cache_disk_module modules/mod_cache_disk.so
#LoadModule cache_socache_module modules/mod_cache_socache.so
#LoadModule socache_shmcb_module modules/mod_socache_shmcb.so
#LoadModule socache_dbm_module modules/mod_socache_dbm.so
#LoadModule socache_memcache_module modules/mod_socache_memcache.so
#LoadModule socache_redis_module modules/mod_socache_redis.so
#LoadModule watchdog_module modules/mod_watchdog.so
#LoadModule macro_module modules/mod_macro.so
#LoadModule dbd_module modules/mod_dbd.so
#LoadModule bucketeer_module modules/mod_bucketeer.so
#LoadModule dumpio_module modules/mod_dumpio.so
#LoadModule echo_module modules/mod_echo.so
#LoadModule example_hooks_module modules/mod_example_hooks.so
#LoadModule case_filter_module modules/mod_case_filter.so
#LoadModule case_filter_in_module modules/mod_case_filter_in.so
#LoadModule example_ipc_module modules/mod_example_ipc.so
#LoadModule buffer_module modules/mod_buffer.so
#LoadModule data_module modules/mod_data.so
#LoadModule ratelimit_module modules/mod_ratelimit.so
LoadModule reqtimeout_module modules/mod_reqtimeout.so
#LoadModule ext_filter_module modules/mod_ext_filter.so
#LoadModule request_module modules/mod_request.so
#LoadModule include_module modules/mod_include.so
LoadModule filter_module modules/mod_filter.so
#LoadModule reflector_module modules/mod_reflector.so
#LoadModule substitute_module modules/mod_substitute.so
#LoadModule sed_module modules/mod_sed.so
#LoadModule charset_lite_module modules/mod_charset_lite.so
#LoadModule deflate_module modules/mod_deflate.so
#LoadModule xml2enc_module modules/mod_xml2enc.so
#LoadModule proxy_html_module modules/mod_proxy_html.so
LoadModule brotli_module modules/mod_brotli.so
LoadModule mime_module modules/mod_mime.so
#LoadModule ldap_module modules/mod_ldap.so
LoadModule log_config_module modules/mod_log_config.so
#LoadModule log_debug_module modules/mod_log_debug.so
#LoadModule log_forensic_module modules/mod_log_forensic.so
#LoadModule logio_module modules/mod_logio.so
#LoadModule lua_module modules/mod_lua.so
LoadModule env_module modules/mod_env.so
#LoadModule mime_magic_module modules/mod_mime_magic.so
#LoadModule cern_meta_module modules/mod_cern_meta.so
#LoadModule expires_module modules/mod_expires.so
LoadModule headers_module modules/mod_headers.so
#LoadModule ident_module modules/mod_ident.so
#LoadModule usertrack_module modules/mod_usertrack.so
#LoadModule unique_id_module modules/mod_unique_id.so
LoadModule setenvif_module modules/mod_setenvif.so
LoadModule version_module modules/mod_version.so
#LoadModule remoteip_module modules/mod_remoteip.so
LoadModule proxy_module modules/mod_proxy.so
#LoadModule proxy_connect_module modules/mod_proxy_connect.so
#LoadModule proxy_ftp_module modules/mod_proxy_ftp.so
#LoadModule proxy_http_module modules/mod_proxy_http.so
LoadModule proxy_fcgi_module modules/mod_proxy_fcgi.so
#LoadModule proxy_scgi_module modules/mod_proxy_scgi.so
#LoadModule proxy_uwsgi_module modules/mod_proxy_uwsgi.so
#LoadModule proxy_fdpass_module modules/mod_proxy_fdpass.so
#LoadModule proxy_wstunnel_module modules/mod_proxy_wstunnel.so
#LoadModule proxy_ajp_module modules/mod_proxy_ajp.so
#LoadModule proxy_balancer_module modules/mod_proxy_balancer.so
#LoadModule proxy_express_module modules/mod_proxy_express.so
#LoadModule proxy_hcheck_module modules/mod_proxy_hcheck.so
#LoadModule session_module modules/mod_session.so
#LoadModule session_cookie_module modules/mod_session_cookie.so
#LoadModule session_crypto_module modules/mod_session_crypto.so
#LoadModule session_dbd_module modules/mod_session_dbd.so
#LoadModule slotmem_shm_module modules/mod_slotmem_shm.so
#LoadModule slotmem_plain_module modules/mod_slotmem_plain.so
#LoadModule ssl_module modules/mod_ssl.so
#LoadModule optional_hook_export_module modules/mod_optional_hook_export.so
#LoadModule optional_hook_import_module modules/mod_optional_hook_import.so
#LoadModule optional_fn_import_module modules/mod_optional_fn_import.so
#LoadModule optional_fn_export_module modules/mod_optional_fn_export.so
#LoadModule dialup_module modules/mod_dialup.so
#LoadModule http2_module modules/mod_http2.so
#LoadModule proxy_http2_module modules/mod_proxy_http2.so
#LoadModule md_module modules/mod_md.so
#LoadModule lbmethod_byrequests_module modules/mod_lbmethod_byrequests.so
#LoadModule lbmethod_bytraffic_module modules/mod_lbmethod_bytraffic.so
#LoadModule lbmethod_bybusyness_module modules/mod_lbmethod_bybusyness.so
#LoadModule lbmethod_heartbeat_module modules/mod_lbmethod_heartbeat.so
LoadModule unixd_module modules/mod_unixd.so
#LoadModule heartbeat_module modules/mod_heartbeat.so
#LoadModule heartmonitor_module modules/mod_heartmonitor.so
#LoadModule dav_module modules/mod_dav.so
LoadModule status_module modules/mod_status.so
LoadModule autoindex_module modules/mod_autoindex.so
#LoadModule asis_module modules/mod_asis.so
#LoadModule info_module modules/mod_info.so
#LoadModule suexec_module modules/mod_suexec.so
<IfModule !mpm_prefork_module>
	#LoadModule cgid_module modules/mod_cgid.so
</IfModule>
<IfModule mpm_prefork_module>
	#LoadModule cgi_module modules/mod_cgi.so
</IfModule>
#LoadModule dav_fs_module modules/mod_dav_fs.so
#LoadModule dav_lock_module modules/mod_dav_lock.so
#LoadModule vhost_alias_module modules/mod_vhost_alias.so
#LoadModule negotiation_module modules/mod_negotiation.so
LoadModule dir_module modules/mod_dir.so
#LoadModule imagemap_module modules/mod_imagemap.so
#LoadModule actions_module modules/mod_actions.so
#LoadModule speling_module modules/mod_speling.so
#LoadModule userdir_module modules/mod_userdir.so
LoadModule alias_module modules/mod_alias.so
LoadModule rewrite_module modules/mod_rewrite.so

<IfModule unixd_module>
#
# If you wish httpd to run as a different user or group, you must run
# httpd as root initially and it will switch.  
#
# User/Group: The name (or #number) of the user/group to run httpd as.
# It is usually good practice to create a dedicated user and group for
# running httpd, as with most system services.
#
User www-data
Group www-data

</IfModule>

# 'Main' server configuration
#
# The directives in this section set up the values used by the 'main'
# server, which responds to any requests that aren't handled by a
# <VirtualHost> definition.  These values also provide defaults for
# any <VirtualHost> containers you may define later in the file.
#
# All of these directives may appear inside <VirtualHost> containers,
# in which case these default settings will be overridden for the
# virtual host being defined.
#

#
# ServerAdmin: Your address, where problems with the server should be
# e-mailed.  This address appears on some server-generated pages, such
# as error documents.  e.g. admin@your-domain.com
#
ServerAdmin you@example.com

#
# ServerName gives the name and port that the server uses to identify itself.
# This can often be determined automatically, but we recommend you specify
# it explicitly to prevent problems during startup.
#
# If your host doesn't have a registered DNS name, enter its IP address here.
#
#ServerName www.example.com:80

#
# Deny access to the entirety of your server's filesystem. You must
# explicitly permit access to web content directories in other 
# <Directory> blocks below.
#
<Directory />
    AllowOverride none
    Require all denied
</Directory>

#
# Note that from this point forward you must specifically allow
# particular features to be enabled - so if something's not working as
# you might expect, make sure that you have specifically enabled it
# below.
#

#
# DocumentRoot: The directory out of which you will serve your
# documents. By default, all requests are taken from this directory, but
# symbolic links and aliases may be used to point to other locations.
#
DocumentRoot "/usr/local/apache2/htdocs"
<Directory "/usr/local/apache2/htdocs">
    #
    # Possible values for the Options directive are "None", "All",
    # or any combination of:
    #   Indexes Includes FollowSymLinks SymLinksifOwnerMatch ExecCGI MultiViews
    #
    # Note that "MultiViews" must be named *explicitly* --- "Options All"
    # doesn't give it to you.
    #
    # The Options directive is both complicated and important.  Please see
    # http://httpd.apache.org/docs/2.4/mod/core.html#options
    # for more information.
    #
    Options Indexes FollowSymLinks

    #
    # AllowOverride controls what directives may be placed in .htaccess files.
    # It can be "All", "None", or any combination of the keywords:
    #   AllowOverride FileInfo AuthConfig Limit
    #
    AllowOverride None

    #
    # Controls who can get stuff from this server.
    #
    Require all granted
</Directory>

#
# DirectoryIndex: sets the file that Apache will serve if a directory
# is requested.
#
<IfModule dir_module>
    DirectoryIndex index.html
</IfModule>

#
# The following lines prevent .htaccess and .htpasswd files from being 
# viewed by Web clients. 
#
<Files ".ht*">
    Require all denied
</Files>

#
# ErrorLog: The location of the error log file.
# If you do not specify an ErrorLog directive within a <VirtualHost>
# container, error messages relating to that virtual host will be
# logged here.  If you *do* define an error logfile for a <VirtualHost>
# container, that host's errors will be logged there and not here.
#
ErrorLog /proc/self/fd/2

#
# LogLevel: Control the number of messages logged to the error_log.
# Possible values include: debug, info, notice, warn, error, crit,
# alert, emerg.
#
LogLevel warn

<IfModule log_config_module>
    #
    # The following directives define some format nicknames for use with
    # a CustomLog directive (see below).
    #
    LogFormat "%h %l %u %t \"%r\" %>s %b \"%{Referer}i\" \"%{User-Agent}i\"" combined
    LogFormat "%h %l %u %t \"%r\" %>s %b" common

    <IfModule logio_module>
      # You need to enable mod_logio.c to use %I and %O
      LogFormat "%h %l %u %t \"%r\" %>s %b \"%{Referer}i\" \"%{User-Agent}i\" %I %O" combinedio
    </IfModule>

    #
    # The location and format of the access logfile (Common Logfile Format).
    # If you do not define any access logfiles within a <VirtualHost>
    # container, they will be logged here.  Contrariwise, if you *do*
    # define per-<VirtualHost> access logfiles, transactions will be
    # logged therein and *not* in this file.
    #
    CustomLog /proc/self/fd/1 common

    #
    # If you prefer a logfile with access, agent, and referer information
    # (Combined Logfile Format) you can use the following directive.
    #
    #CustomLog "logs/access_log" combined
</IfModule>

<IfModule alias_module>
    #
    # Redirect: Allows you to tell clients about documents that used to 
    # exist in your server's namespace, but do not anymore. The client 
    # will make a new request for the document at its new location.
    # Example:
    # Redirect permanent /foo http://www.example.com/bar

    #
    # Alias: Maps web paths into filesystem paths and is used to
    # access content that does not live under the DocumentRoot.
    # Example:
    # Alias /webpath /full/filesystem/path
    #
    # If you include a trailing / on /webpath then the server will
    # require it to be present in the URL.  You will also likely
    # need to provide a <Directory> section to allow access to
    # the filesystem path.

    #
    # ScriptAlias: This controls which directories contain server scripts. 
    # ScriptAliases are essentially the same as Aliases, except that
    # documents in the target directory are treated as applications and
    # run by the server when requested rather than as documents sent to the
    # client.  The same rules about trailing "/" apply to ScriptAlias
    # directives as to Alias.
    #
    #ScriptAlias /cgi-bin/ "/usr/local/apache2/cgi-bin/"

</IfModule>

<IfModule cgid_module>
    #
    # ScriptSock: On threaded servers, designate the path to the UNIX
    # socket used to communicate with the CGI daemon of mod_cgid.
    #
    #Scriptsock cgisock
</IfModule>

#
# "/usr/local/apache2/cgi-bin" should be changed to whatever your ScriptAliased
# CGI directory exists, if you have that configured.
#
<Directory "/usr/local/apache2/cgi-bin">
    AllowOverride None
    Options None
    Require all granted
</Directory>

<IfModule headers_module>
    #
    # Avoid passing HTTP_PROXY environment to CGI's on this or any proxied
    # backend servers which have lingering "httpoxy" defects.
    # 'Proxy' request header is undefined by the IETF, not listed by IANA
    #
    RequestHeader unset Proxy early
</IfModule>

<IfModule mime_module>
    #
    # TypesConfig points to the file containing the list of mappings from
    # filename extension to MIME-type.
    #
    TypesConfig conf/mime.types

    #
    # AddType allows you to add to or override the MIME configuration
    # file specified in TypesConfig for specific file types.
    #
    #AddType application/x-gzip .tgz
    #
    # AddEncoding allows you to have certain browsers uncompress
    # information on the fly. Note: Not all browsers support this.
    #
    #AddEncoding x-compress .Z
    #AddEncoding x-gzip .gz .tgz
    #
    # If the AddEncoding directives above are commented-out, then you
    # probably should define those extensions to indicate media types:
    #
    AddType application/x-compress .Z
    AddType application/x-gzip .gz .tgz

    #
    # AddHandler allows you to map certain file extensions to "handlers":
    # actions unrelated to filetype. These can be either built into the server
    # or added with the Action directive (see below)
    #
    # To use CGI scripts outside of ScriptAliased directories:
    # (You will also need to add "ExecCGI" to the "Options" directive.)
    #
    #AddHandler cgi-script .cgi

    # For type maps (negotiated resources):
    #AddHandler type-map var

    #
    # Filters allow you to process content before it is sent to the client.
    #
    # To parse .shtml files for server-side includes (SSI):
    # (You will also need to add "Includes" to the "Options" directive.)
    #
    #AddType text/html .shtml
    #AddOutputFilter INCLUDES .shtml
</IfModule>

#
# The mod_mime_magic module allows the server to use various hints from the
# contents of the file itself to determine its type.  The MIMEMagicFile
# directive tells the module where the hint definitions are located.
#
#MIMEMagicFile conf/magic

#
# Customizable error responses come in three flavors:
# 1) plain text 2) local redirects 3) external redirects
#
# Some examples:
#ErrorDocument 500 "The server made a boo boo."
#ErrorDocument 404 /missing.html
#ErrorDocument 404 "/cgi-bin/missing_handler.pl"
#ErrorDocument 402 http://www.example.com/subscription_info.html
#

#
# MaxRanges: Maximum number of Ranges in a request before
# returning the entire resource, or one of the special
# values 'default', 'none' or 'unlimited'.
# Default setting is to accept 200 Ranges.
#MaxRanges unlimited

#
# EnableMMAP and EnableSendfile: On systems that support it, 
# memory-mapping or the sendfile syscall may be used to deliver
# files.  This usually improves server performance, but must
# be turned off when serving from networked-mounted 
# filesystems or if support for these functions is otherwise
# broken on your system.
# Defaults: EnableMMAP On, EnableSendfile Off
#
#EnableMMAP off
#EnableSendfile on

# Supplemental configuration
#
# The configuration files in the conf/extra/ directory can be 
# included to add extra features or to modify the default configuration of 
# the server, or you may simply copy their contents here and change as 
# necessary.

# Server-pool management (MPM specific)
#Include conf/extra/httpd-mpm.conf

# Multi-language error messages
#Include conf/extra/httpd-multilang-errordoc.conf

# Fancy directory listings
#Include conf/extra/httpd-autoindex.conf

# Language settings
#Include conf/extra/httpd-languages.conf

# User home directories
#Include conf/extra/httpd-userdir.conf

# Real-time info on requests and configuration
#Include conf/extra/httpd-info.conf

# Virtual hosts
#Include conf/extra/httpd-vhosts.conf

# Local access to the Apache HTTP Server Manual
#Include conf/extra/httpd-manual.conf

# Distributed authoring and versioning (WebDAV)
#Include conf/extra/httpd-dav.conf

# Various default settings
#Include conf/extra/httpd-default.conf

# Configure mod_proxy_html to understand HTML4/XHTML1
<IfModule proxy_html_module>
Include conf/extra/proxy-html.conf
</IfModule>

# Secure (SSL/TLS) connections
#Include conf/extra/httpd-ssl.conf
#
# Note: The following must must be present to support
#       starting without SSL on platforms with no /dev/random equivalent
#       but a statically compiled-in mod_ssl.
#
<IfModule ssl_module>
SSLRandomSeed startup builtin
SSLRandomSeed connect builtin
</IfModule>

Include conf/nextcloud.conf
ServerName localhost
```

sudo docker exec nextcloud-aio-apache cat /usr/local/apache2/conf/nextcloud.conf
```
Listen 8000
<VirtualHost *:8000>
    ServerName localhost

    # Add error log
    CustomLog /proc/self/fd/1 proxy
    LogFormat "%{X-Forwarded-For}i %l %u %t \"%r\" %>s %b \"%{Referer}i\" \"%{User-Agent}i\"" proxy
    ErrorLog /proc/self/fd/2
    ErrorLogFormat "[%t] [%l] [%E] [client: %{X-Forwarded-For}i] [%M] [%{User-Agent}i]"
    LogLevel warn

    # PHP match
    <FilesMatch "\.php$">
        SetHandler "proxy:fcgi://${NEXTCLOUD_HOST}:9000"
    </FilesMatch>

    # Enable Brotli compression for js, css and svg files - other plain files are compressed by Nextcloud by default
    <IfModule mod_brotli.c>
        AddOutputFilterByType BROTLI_COMPRESS text/javascript application/javascript application/x-javascript text/css image/svg+xml
        BrotliCompressionQuality 0
    </IfModule>

    # Nextcloud dir
    DocumentRoot /var/www/html/
    <Directory /var/www/html/>
        Options Indexes FollowSymLinks
        Require all granted
        AllowOverride All
        Options FollowSymLinks MultiViews
        Satisfy Any
        <IfModule mod_dav.c>
            Dav off
        </IfModule>
    </Directory>
    # Deny access to .ht files
    <Files ".ht*">
        Require all denied
    </Files>

    # Fix zero file sizes 
    # See https://github.com/nextcloud/server/issues/3056#issuecomment-954209565
    SetEnv proxy-sendcl 1

    # See https://httpd.apache.org/docs/current/en/mod/core.html#limitrequestbody
    LimitRequestBody ${APACHE_MAX_SIZE}

    # See https://httpd.apache.org/docs/current/mod/core.html#timeout
    Timeout ${APACHE_MAX_TIME}

    # See https://httpd.apache.org/docs/current/mod/mod_proxy.html#proxytimeout
    ProxyTimeout ${APACHE_MAX_TIME}
</VirtualHost>
```


sudo docker inspect nextcloud-aio-apache
```

    {
        "Id": "457480b846f654a2c0853fb49b0001d1a7a010cbf2ca625ad9b044322562015f",
        "Created": "2023-11-01T04:02:27.736831748Z",
        "Path": "/start.sh",
        "Args": [
            "/usr/bin/supervisord",
            "-c",
            "/supervisord.conf"
        ],
        "State": {
            "Status": "running",
            "Running": true,
            "Paused": false,
            "Restarting": false,
            "OOMKilled": false,
            "Dead": false,
            "Pid": 4143612,
            "ExitCode": 0,
            "Error": "",
            "StartedAt": "2023-11-01T04:02:28.979821838Z",
            "FinishedAt": "0001-01-01T00:00:00Z",
            "Health": {
                "Status": "healthy",
                "FailingStreak": 0,
                "Log": [
                    {
                        "Start": "2023-11-01T15:21:34.669833075+01:00",
                        "End": "2023-11-01T15:21:34.807633626+01:00",
                        "ExitCode": 0,
                        "Output": ""
                    },
                    {
                        "Start": "2023-11-01T15:22:04.815763564+01:00",
                        "End": "2023-11-01T15:22:04.957124953+01:00",
                        "ExitCode": 0,
                        "Output": ""
                    },
                    {
                        "Start": "2023-11-01T15:22:34.967758828+01:00",
                        "End": "2023-11-01T15:22:35.073217539+01:00",
                        "ExitCode": 0,
                        "Output": ""
                    },
                    {
                        "Start": "2023-11-01T15:23:05.082251075+01:00",
                        "End": "2023-11-01T15:23:05.219703759+01:00",
                        "ExitCode": 0,
                        "Output": ""
                    },
                    {
                        "Start": "2023-11-01T15:23:35.227362056+01:00",
                        "End": "2023-11-01T15:23:35.338314297+01:00",
                        "ExitCode": 0,
                        "Output": ""
                    }
                ]
            }
        },
        "Image": "sha256:79bc1e42c83c75702ca7bcfbca8e9566d5d13ae995ce9e69c0190dcb4f613421",
        "ResolvConfPath": "/var/lib/docker/containers/457480b846f654a2c0853fb49b0001d1a7a010cbf2ca625ad9b044322562015f/resolv.conf",
        "HostnamePath": "/var/lib/docker/containers/457480b846f654a2c0853fb49b0001d1a7a010cbf2ca625ad9b044322562015f/hostname",
        "HostsPath": "/var/lib/docker/containers/457480b846f654a2c0853fb49b0001d1a7a010cbf2ca625ad9b044322562015f/hosts",
        "LogPath": "/var/lib/docker/containers/457480b846f654a2c0853fb49b0001d1a7a010cbf2ca625ad9b044322562015f/457480b846f654a2c0853fb49b0001d1a7a010cbf2ca625ad9b044322562015f-json.log",
        "Name": "/nextcloud-aio-apache",
        "RestartCount": 0,
        "Driver": "overlay2",
        "Platform": "linux",
        "MountLabel": "",
        "ProcessLabel": "",
        "AppArmorProfile": "docker-default",
        "ExecIDs": null,
        "HostConfig": {
            "Binds": [
                "nextcloud_aio_nextcloud:/var/www/html:ro",
                "nextcloud_aio_apache:/mnt/data:rw"
            ],
            "ContainerIDFile": "",
            "LogConfig": {
                "Type": "json-file",
                "Config": {}
            },
            "NetworkMode": "nextcloud-aio",
            "PortBindings": {
                "443/tcp": [
                    {
                        "HostIp": "",
                        "HostPort": "443"
                    }
                ],
                "443/udp": [
                    {
                        "HostIp": "",
                        "HostPort": "443"
                    }
                ]
            },
            "RestartPolicy": {
                "Name": "unless-stopped",
                "MaximumRetryCount": 0
            },
            "AutoRemove": false,
            "VolumeDriver": "",
            "VolumesFrom": null,
            "CapAdd": null,
            "CapDrop": [
                "NET_RAW"
            ],
            "CgroupnsMode": "private",
            "Dns": null,
            "DnsOptions": null,
            "DnsSearch": null,
            "ExtraHosts": null,
            "GroupAdd": null,
            "IpcMode": "private",
            "Cgroup": "",
            "Links": null,
            "OomScoreAdj": 0,
            "PidMode": "",
            "Privileged": false,
            "PublishAllPorts": false,
            "ReadonlyRootfs": true,
            "SecurityOpt": null,
            "Tmpfs": {
                "/home/www-data": "",
                "/tmp": "",
                "/usr/local/apache2/logs": "",
                "/var/log/supervisord": "",
                "/var/run/supervisord": ""
            },
            "UTSMode": "",
            "UsernsMode": "",
            "ShmSize": 67108864,
            "Runtime": "runc",
            "ConsoleSize": [
                0,
                0
            ],
            "Isolation": "",
            "CpuShares": 0,
            "Memory": 0,
            "NanoCpus": 0,
            "CgroupParent": "",
            "BlkioWeight": 0,
            "BlkioWeightDevice": null,
            "BlkioDeviceReadBps": null,
            "BlkioDeviceWriteBps": null,
            "BlkioDeviceReadIOps": null,
            "BlkioDeviceWriteIOps": null,
            "CpuPeriod": 0,
            "CpuQuota": 0,
            "CpuRealtimePeriod": 0,
            "CpuRealtimeRuntime": 0,
            "CpusetCpus": "",
            "CpusetMems": "",
            "Devices": null,
            "DeviceCgroupRules": null,
            "DeviceRequests": null,
            "KernelMemory": 0,
            "KernelMemoryTCP": 0,
            "MemoryReservation": 0,
            "MemorySwap": 0,
            "MemorySwappiness": null,
            "OomKillDisable": null,
            "PidsLimit": null,
            "Ulimits": null,
            "CpuCount": 0,
            "CpuPercent": 0,
            "IOMaximumIOps": 0,
            "IOMaximumBandwidth": 0,
            "MaskedPaths": [
                "/proc/asound",
                "/proc/acpi",
                "/proc/kcore",
                "/proc/keys",
                "/proc/latency_stats",
                "/proc/timer_list",
                "/proc/timer_stats",
                "/proc/sched_debug",
                "/proc/scsi",
                "/sys/firmware"
            ],
            "ReadonlyPaths": [
                "/proc/bus",
                "/proc/fs",
                "/proc/irq",
                "/proc/sys",
                "/proc/sysrq-trigger"
            ],
            "Init": true
        },
        "GraphDriver": {
            "Data": {
                "LowerDir": "/var/lib/docker/overlay2/a5ab0d60749ec06c14dbf21a4c8bcd7069adeac40f1b8f6bc44e1ada664b48ac-init/diff:/var/lib/docker/overlay2/711bc458838b55639736ee924ac2430b66ab9700c0cd6a16429d56af35a71a00/diff:/var/lib/docker/overlay2/81b04e71e455936861bc853860e671887866a4d8c6b55ae1bd1cbf30bc8bb10e/diff:/var/lib/docker/overlay2/c35c67348aea98581a1adda2fc0ad0b6ff8f19139b1e637f014993a9f6a76f25/diff:/var/lib/docker/overlay2/44738a790ad06216075d3fc5ae131015e58790345dd1a60b171261650abeafe1/diff:/var/lib/docker/overlay2/653e25b8282ab39ecad418fd9e610f4f93e18c6d498431a653058157d04d891c/diff:/var/lib/docker/overlay2/5c7e79f045f35bbe20b75266631b009cd0d69353331ed5138c51e28045c284ef/diff:/var/lib/docker/overlay2/109d187c7ab23cd287e41e81983b4d730fb723dbf90ab80f1e9071f62fc011c3/diff:/var/lib/docker/overlay2/ee848d68ad5d5df732edd78284c688d3fab793c5827f686c2d2e47591d00923c/diff:/var/lib/docker/overlay2/0a4932ce422b2e194f345bb5544ce765728a2fdb38fd93063bbe2aaadcd0776a/diff:/var/lib/docker/overlay2/10f68340d43cfb236511d9b4e16c4bb7cbdc2c14a01ded8032fa2dbef111836d/diff:/var/lib/docker/overlay2/4421e64f9ef73431eb7f5e5a487ce31fd95961754d7b6d35532d3b07446ce246/diff:/var/lib/docker/overlay2/b5c4d2481dc2cdd0deb3745ee5247a0764c9347123ff71dbd537e3882c0d8801/diff:/var/lib/docker/overlay2/011de0e5736433ef7d596ceacf3fa3f5f7170a9f71ee887aefae9ad3bfa3f4a7/diff",
                "MergedDir": "/var/lib/docker/overlay2/a5ab0d60749ec06c14dbf21a4c8bcd7069adeac40f1b8f6bc44e1ada664b48ac/merged",
                "UpperDir": "/var/lib/docker/overlay2/a5ab0d60749ec06c14dbf21a4c8bcd7069adeac40f1b8f6bc44e1ada664b48ac/diff",
                "WorkDir": "/var/lib/docker/overlay2/a5ab0d60749ec06c14dbf21a4c8bcd7069adeac40f1b8f6bc44e1ada664b48ac/work"
            },
            "Name": "overlay2"
        },
        "Mounts": [
            {
                "Type": "volume",
                "Name": "nextcloud_aio_nextcloud",
                "Source": "/var/lib/docker/volumes/nextcloud_aio_nextcloud/_data",
                "Destination": "/var/www/html",
                "Driver": "local",
                "Mode": "ro",
                "RW": false,
                "Propagation": ""
            },
            {
                "Type": "volume",
                "Name": "nextcloud_aio_apache",
                "Source": "/var/lib/docker/volumes/nextcloud_aio_apache/_data",
                "Destination": "/mnt/data",
                "Driver": "local",
                "Mode": "rw",
                "RW": true,
                "Propagation": ""
            }
        ],
        "Config": {
            "Hostname": "457480b846f6",
            "Domainname": "",
            "User": "www-data",
            "AttachStdin": false,
            "AttachStdout": false,
            "AttachStderr": false,
            "ExposedPorts": {
                "443/tcp": {},
                "443/udp": {},
                "80/tcp": {}
            },
            "Tty": false,
            "OpenStdin": false,
            "StdinOnce": false,
            "Env": [
                "NC_DOMAIN=[STRIPPED]",
                "NEXTCLOUD_HOST=nextcloud-aio-nextcloud",
                "COLLABORA_HOST=nextcloud-aio-collabora",
                "TALK_HOST=nextcloud-aio-talk",
                "APACHE_PORT=443",
                "ONLYOFFICE_HOST=nextcloud-aio-onlyoffice",
                "TZ=Etc/UTC",
                "APACHE_MAX_SIZE=10737418240",
                "APACHE_MAX_TIME=3600",
                "NOTIFY_PUSH_HOST=nextcloud-aio-notify-push",
                "PATH=/usr/local/apache2/bin:/usr/local/sbin:/usr/local/bin:/usr/sbin:/usr/bin:/sbin:/bin",
                "HTTPD_PREFIX=/usr/local/apache2",
                "HTTPD_VERSION=2.4.58",
                "HTTPD_SHA256=fa16d72a078210a54c47dd5bef2f8b9b8a01d94909a51453956b3ec6442ea4c5",
                "HTTPD_PATCHES="
            ],
            "Cmd": [
                "/usr/bin/supervisord",
                "-c",
                "/supervisord.conf"
            ],
            "Healthcheck": {
                "Test": [
                    "CMD-SHELL",
                    "/healthcheck.sh"
                ]
            },
            "Image": "nextcloud/aio-apache:latest",
            "Volumes": {
                "/mnt/data": {}
            },
            "WorkingDir": "/usr/local/apache2",
            "Entrypoint": [
                "/start.sh"
            ],
            "OnBuild": null,
            "Labels": {
                "com.centurylinklabs.watchtower.enable": "false"
            },
            "StopSignal": "SIGWINCH"
        },
        "NetworkSettings": {
            "Bridge": "",
            "SandboxID": "fcfd18c382eee15c038affe09e24cdcb5202415ed55292d2d8b6fad525a44331",
            "HairpinMode": false,
            "LinkLocalIPv6Address": "",
            "LinkLocalIPv6PrefixLen": 0,
            "Ports": {
                "443/tcp": [
                    {
                        "HostIp": "0.0.0.0",
                        "HostPort": "443"
                    }
                ],
                "443/udp": [
                    {
                        "HostIp": "0.0.0.0",
                        "HostPort": "443"
                    }
                ],
                "80/tcp": null
            },
            "SandboxKey": "/var/run/docker/netns/fcfd18c382ee",
            "SecondaryIPAddresses": null,
            "SecondaryIPv6Addresses": null,
            "EndpointID": "",
            "Gateway": "",
            "GlobalIPv6Address": "",
            "GlobalIPv6PrefixLen": 0,
            "IPAddress": "",
            "IPPrefixLen": 0,
            "IPv6Gateway": "",
            "MacAddress": "",
            "Networks": {
                "nextcloud-aio": {
                    "IPAMConfig": null,
                    "Links": null,
                    "Aliases": [
                        "457480b846f6"
                    ],
                    "NetworkID": "a532fa9ab615f8cb70544c9ebdead55ff2425ffeb8fa2090282e7014894b6dda",
                    "EndpointID": "0462b0e9389cb238fb8163c8afb01a77a8e9e3f372dc564c46d58a810f12bdb7",
                    "Gateway": "172.18.0.1",
                    "IPAddress": "172.18.0.8",
                    "IPPrefixLen": 16,
                    "IPv6Gateway": "",
                    "GlobalIPv6Address": "",
                    "GlobalIPv6PrefixLen": 0,
                    "MacAddress": "02:42:ac:12:00:08",
                    "DriverOpts": null
                }
            }
        }
    }
]
```

**Comment by szaimen** [comment]
Thanks! Can you post the output of `sudo docker info` ?

Also, can you follow https://github.com/nextcloud/all-in-one/discussions/2045?

**Reply by auceto** [reply]
Hi,
sorry for reopen this old thread,

I done a lot installation in the past whitout any issue but with this version, from scratch, I'm suffering a lot of problem.

I installed Nextcloud AIO from scratch following the guide, this is my configuration:

Nextcloud AIO v9.4.1
Nextcloud Hub 8 29.0.4
Operating System: Linux 6.6.31+rpt-rpi-2712 aarch64
CPU: Raspberry Pi 5 Model B Rev 1.0 (4 cores)
Memory: 7.86 GB
Server time: Sun Aug 18 16:46:20 CEST 2024

Now error 503 accessing at the web page "ERROR: Connection disallowed: IP address '172.18.0.1' has been dropped".

I apply the commands showed at the start of this thread, but the problem occurs at every reboot and I've to repeat the commands.

Is there some definitive solution?
